game_id,game_name,description,score,ratings_count,downloads,content_rating,section,categories
247,Hunter Raid: Idle RPG Games,"Embark on an epic journey in one of the most thrilling idle RPG games, where strategy, action, and progression come together in an immersive experience! Hunter Raid offers a perfect blend of fast-paced action and AFK progression, making it an exciting choice for fans of idle RPG games and battle games alike.Idle RPG Game Features:Explore Cool Dungeons with Diverse Worlds:- Venture through various realms such as Past, Present, Wulin, and Otherworld with stunning visuals, smooth animations, and spectacular battle effects.- This idle RPG game immerses you in its captivating worlds, letting you experience the thrill of adventure without the grind.Unique Job Advancement System:- Progress through the Building of Trials, where you defeat characters from other dimensions, absorb their power, and grow stronger.- Discover diverse skill sets from classes like Berserker, Kensei, Swordmaster, and Dimension Knight - each offering new layers of strategy and depth.Idle Play, AFK Rewards, and Fast Growth:- As a true idle RPG game, enjoy AFK progression where you continue to grow and collect rewards even when offline.- Upgrade your characters effortlessly, gathering resources in your sleep and improving your stats every day!Multiplayer Games and Guild System:- Join forces with others in the Hunter Union, where you’ll form guilds to conquer battles together. The multiplayer games element ensures there’s always a way to collaborate and compete with friends.- Participate in thrilling PVP battles in the Hunter Arena, showcasing your skills and strategies against other players worldwide.Epic Customization & Beast Fusion:- Stand out in battle with various unique costumes to customize your character’s appearance.- Power up using the Beast Fusion System, unlocking new strengths and abilities to conquer even tougher challenges.Intriguing Storyline - Hunter Story Chapter 1:A mysterious red portal has brought devastating monsters to Earth, wiping out 90% of the human population. As monsters continue to pour through these gateways, humanity’s last hope lies in the hands of the Hunters. You must transcend your limits, explore the dimensions of Past, Present, Wulin, and Otherworld, and fight back against the monstrous invasion.The Ultimate Idle RPG Journey Awaits:Hunter Raid delivers everything fans of idle RPG games crave - non-stop action, strategic growth, and rich rewards with minimal effort. Whether you're looking for a casual AFK journey or intense battle games, this idle RPG game offers it all. Dive into grinding games that make progression fun and rewarding, upgrade games that emphasize character development, and multiplayer games that allow for cooperative and competitive gameplay.The battlefield is calling - are you ready to summon powerful forces, conquer your enemies, and unlock the hidden secrets of the red portal? Join the AFK adventure and begin your quest to become the ultimate Hunter!",4.5,30600,1000000,Everyone 10+,Pixelated games,"Role Playing, Idle RPG, Single player, Stylized, Pixelated, Monster"
248,Tizi Princess Home Design Game,"Do you want to design a princess dream house? Here's the chance! Design walls, floor and decor rooms. Indulge in decorating bedroom, living room, kitchen, home and use your interior design skills to redecor spaces in Tizi Town: Home Design Games. Decorate your dream house and renovate your very own princess castle or mansion, make home improvement, create stories with avatars, add room furniture, while you interior design your modern home, creating a unique house design. Role-play as your favorite character in this avatar world. Be the best interior designer in the town. It's a fantasy world where there's no limit to creativity and fun.Dive into the enchanting world of Tizi Town's dream house games! Unleash your creativity with intricate home design options that let you make your own house masterpiece. Craft your dream house in a captivating world town setting, where your avatar can explore and interact. These home designer games offer endless possibilities for kids and families to enjoy, making it an ideal choice for both family and princess games enthusiasts.Choose from a variety of objects & design into a beautiful new home. Become an expert in renovation and unlock more colors and new skills. Style houses using home furnishings added in updates all of the time, catering to different avatars.Features of the app are:* Tons of objects to decorate your rooms* Various royal items to play with!* Touch, drag, and explore every object and see what happens!* Made for kids of ages 6-8, but everyone will enjoy playing in this dollhouse with their unique avatars.* The app is completely free.Be a princess with your personalized avatar right away and start decorating your castle. Download now!",4.5,103000,50000000,Everyone,Pretend play games,"Simulation, Lifestyle, Casual, Single player, Stylized, Handicraft, House & garden, Offline"
249,Differences - Find Difference,"Enjoy the addictive and new find differences games for free, with over 20,000 beautiful and challenging levels! Like a detective!🕵️♂️✅Key Features to ensure the great experience in finding differences⏰No time limit!Relax and enjoy the pleasure of finding hidden objects.💡The secret weapon to finding out the last difference in pictures!❌Focus on the differences between two almost identical pictures.🔍You can zoom in or out on images to help you find the tiny differences more easily.💯You can enjoy traveling around the world in the Find differences games!⬆️Some levels may be hard beyond your imagination: Where is the last hidden object?🏆Daily Challenge, World Travel Theme, and more on the way.👨👩👧👦Even the preferred game for parent-child interaction: brain training in finding the difference games.Have you dreamed of becoming a detective? Are you confident in your observation and detective skills? Are you always able to find the very hard differences or hidden objects in your real life? Here is the Right game for you.A completely FREE Find Differences game with 20,000+ beautiful and challenging levels: variety of difficulty levels, simple and intuitive design, tons of High-quality pictures and photos. Have you ever played a hidden objects game? It is similar! Inspect two almost identical pictures and try to spot all 5 differences, even the hard ones and the hidden objects!Find Differences is a classic relaxing game around the world. It is a type of puzzle where players must find a set number of differences between two otherwise similar images, whether they are illustrations or photographs that have been altered with photo manipulation. Spot the difference games are also known as photo hunt games and were commonly found in activity books or newspapers before the E era. But now! Our game app enables you to easily play tons of Find the Difference games on any mobile device anywhere & anytime.Though it is a free Find differences game, it must be an excellent and fun brain exercise for you!Are you ready for the challenges?📲 Download now!Find out the hidden differences for yourself! Train your brain, be more patient, concentrated, and detective-sensed!🔎Privacy Policy: https://dof.gurugame.ai/policy.htmlTerms of Service: http://gurugame.ai/termsofservice.html🕵️♂️",4.8,245000,10000000,Everyone,Puzzle games,"Puzzle, Find the difference, Casual, Single player, Stylized, Miscellaneous, Puzzles, Offline"
250,Blockudoku®: Block Puzzle Game,"Blockudoku® is an original combination of sudoku and block puzzle games. It is a simple yet challenging and addictive free block puzzle you won’t be able to put down.Match blocks to remove them by completing lines and cubes. Keep the board clean and beat your high score in this block puzzle! Watch blocks blast away as you play! Challenge your IQ and win the block puzzle game!Block puzzle game features:✔ 9x9 block puzzle board. Merge blocks on the 9x9 grid, which should be familiar to all sudoku fans, to build lines and squares.✔ Blocks of various shapes. Strategically stack blocks on the sudoku board to destroy them and keep the board clean.✔ Complete Daily Challenges to get unique trophies while playing block puzzles.✔ Join Seasonal Events and uncover unique animated postcards.✔ Compete against other players in Tournaments, beat your high score, and climb to the top of the leaderboard.✔ Challenging goals. Never stop challenging your IQ in this block puzzle game. Try to beat your high score or compete with friends.✔ Combos. Master the block puzzle game by destroying multiple tiles with just one move.✔ Streak. Score more points by eliminating blocks with several successful moves in a row. Go full blast and destroy as many blocks as you can!✔ Unique addicting mechanics. Blockudoku® has been created as a highly playable mixture of sudoku and a block puzzle game.✔ Addictive gameplay. Play block games when you are bored or eager to train your brain whenever and wherever you want!How to become a Blockudoku® master?There is no time limit in this block game, so no rush. Think one step ahead when you face a difficult move. It might become your last one!Try to build blocks on the puzzle board to destroy lines or 3x3 squares with every move in order not to fill up the board.Find your zen in this addicting game by balancing between blasting blocks as quickly as possible and getting as many combos and streaks as you can to score higher.Why play this block puzzle game?Blockudoku® block puzzle has been designed for people who want to unwind and train their brain at the same time. This block puzzle game includes combinations of various scales and complexity together with simple addictive gameplay which is similar to block puzzle and sudoku games. Whether you are tired or in low spirits, a few rounds of playing Blockudoku® block puzzle will cheer you up and let your mind relax.If you like challenging yourself with block games, Blockudoku® is the perfect option for you. Take a break from the daily grind and get rid of negative thoughts by immersing yourself in this brain teaser. Enjoy the satisfying feeling of making streaks and combos, and watch every block blast away while exploring the captivating world of Blockudoku® addicting games! You definitely won't be bored playing block puzzle games! Relieve stress or train your brain with a relaxing yet challenging block puzzle game of Blockudoku® with block blast excitement anywhere, anytime!Terms of Use:https://easybrain.com/termsPrivacy Policy:https://easybrain.com/privacy",4.3,1160000,100000000,Everyone,Puzzle games,"Puzzle, Block, Casual, Single player, Abstract, Miscellaneous, Puzzles, Offline"
251,No Limit Drag Racing 2,"No Limit Drag Racing 2 brings the thrill of real driving simulation to your fingertips. Immerse yourself in hyper-real drag racing, offering an unparalleled mobile racing experience. Join millions of players and engage in intense head-to-head competitions, showcasing your skills in the world of high-speed motorsports.Key Features:Comprehensive Car CustomizationPersonalize your vehicles with custom paint jobs, wraps, decals, wheels, and body kits.Explore countless combinations to create a unique racing machine.Advanced Tuning and UpgradesFine-tune every aspect of your car's performance, including gearing, suspension, timing, and fuel delivery.Utilize the in-game dyno to test and optimize your setups for maximum efficiency.Competitive Multiplayer RacingChallenge real players from around the globe in real-time races.Climb the global leaderboards and establish your reputation as a top racer.Engaging Car ShowsShowcase your customized cars in competitions to win prizes and earn respect within the racing community.Membership Options:Enhance your gaming experience with our exclusive membership plans:No Limit Membership – $9.99/MonthMember badge in multiplayerAd-free gameplay20% discount on parts400 Gold bonus2X rewardsOne free Strip CarAdditional decal layersFree dyno runsAccess to live eventsExtra garage propsUnlock Map Maker and Car ShowsElite Membership – $29.99/ Six MonthsElite Member badge in multiplayerAd-free gameplay30% discount on parts800 Gold bonus3X rewardsOne free Strip CarAdditional decal layersFree dyno runsAccess to live eventsExtra garage propsUnlock Map Maker and Car ShowsOne free Limited CarEarly access to beta featuresAdditional Information:No Limit Drag Racing 2 is free to download and play, with optional in-game purchases available.For the best experience, an internet connection is recommended.Follow us on Facebook for the latest updates: http://facebook.com/NoLimitDragRacingEncountered an issue? Contact our support team before leaving a negative review.Terms and Policies:Terms of Service: http://www.battlecreekgames.com/nlterms.htmPrivacy Policy: http://www.battlecreekgames.com/nlprivacy.htmDownload No Limit Drag Racing 2 today and dominate the drag racing world!",4.1,87000,10000000,Everyone,Racing games,"#4 top grossing racing, Racing, Drag racing, Casual, Multiplayer, Competitive multiplayer, Single player, Realistic, Vehicles, Sports car, Offline"
252,Drive Zone: Car Simulator Game,"Drive Zone Online is a car driving simulator. Burn your tires on the asphalt and explore ""Grand Car Parking City"" and the world around it. You can participate in street racing, drift racing, drag racing or invite a friend and drive around the city together.Endless open world-Resort coastline measuring 20x20km-City, desert airfield, racing track, highway, beach area, port and many other areas-Up to 32 players with you online-Tens of kilometers of roads and hundreds of hidden bonuses on the mapAuto and tuning-50+ cars including vintage cars, supercars, suvs, hypercars-30+ body kits for each car. Rims, bumpers, spoilers, bodykits, liveries.-Free vinyl editor with which you can draw your personal skin of any complexity-Suspension and camber adjustments to improve vehicle handling and appearance-The engine and gearbox are pumped, which will help to defeat your rivals-Each car has a well-designed interior and engine, all doors, hood and trunk open!Great graphics-Realistic DZO graphics create the coolest picture in a mobile phone game-Detailed interior of the car allows you to play in the first person with impressive emotions-High performance allows you to play not only on powerful devices-Advanced graphics settings will allow you to choose everything you needGameplayNo boundaries. Earn money for new cars not only by participating in races, but also by simply performing stunts and gaining drift points or by selling your cars and skins to other players on the market like a real outbid.-DRIFT mode - you and other players will compete for the most drift points-CAR RACE mode - the winner will be the one who crosses the finish line first, avoiding a severe accident-SKILL TEST mode - race around insane ski jump karts-Driving school, where you will be taught to drive a car with dignity, will let you test many cars and after passing will be rewarded with special awards.-Auto market - trade with other players and wager RP to earn or get rare and valuable items-Hundreds of tasks, quests and achievements with their own rewardsWE DEVELOP THE GAME TOGETHERFollow the news and participate in regular contests and polls that are held on social networks:discord.gg/aR3nyK3VCEyoutube.com/@DriveZoneOnlineinstagram.com/drivezone_onlinet.me/drivezoneofficialfacebook.com/drivezoneonline/tiktok.com/@drivezoneonlineTake part and help with your ideas in the development of the project by answering, for example, the following questions:Does the game need city traffic or police?Do you like drifting and driving physics?What are you waiting for, Driver.. Welcome to the family, your new friends in multiplayer are waiting for you. Start your car and go beyond the horizon of the Drive Zone Online!",4.1,154000,50000000,Everyone,Racing games,"#6 top grossing racing, Simulation, Vehicle, Car sim, Single player, Stylized, Vehicles, Car"
253,Big Rig Racing: Drag racing,"Big Rig Racing is a drag racing game on mega-cool trucks!Become a formidable rival on 18-wheeler in drag racing games! Drive big trucks offroad & join the professionals. Team up to demolish the strongest gangs of racers on hot asphalt tracks and even chill icy roads! Build your career to be claimed as a winner in truck race! Get ready to experience the thrill of truck racing games like never before with us! With realistic physics and intuitive controls, you'll feel like you're behind the wheel of a real big rig in driving simulator.CUSTOMIZE AND UPGRADE CARBRR offers advanced truck customizer options as you level up! Paintwork, rims, wheels, headlights, mirrors, bumpers & even tubes! Earn upgrades and other rewards! Get the best parts to create a road rip mac in diesel truck games.COLLECT AND EXHIBIT TRUCKSExplore an amazingly enormous selection. Ageless classics and their forms are all available. Buy any modifications, add them & personalize how your machines look and run! Test out the possible combinations you can try in the garage! Exhibit your burnout monster, get votes & win!REALISTIC RIVALSDive in a story with off road outlaws you will be driving as you rise the ranks! Original and unique characters are waiting for you! Take down the top kings and prove to the entire world you're the best of the best! Truck em all!RACE MODESCompete in races against strong racers in different game modes: career (story), race (series), tournament (ladder) or high stakes (daily race). Trailers races and even a tournament ladder to win yourself some nice cash! In addition to a brand new High Stakes mode that lets you put your money where your mouth is! Classic Drag Racing simulator: train and practice on tracks to perfect your skills and time! Many locations and options to choose from!SEASON SYSTEMNew location, themed semi trucks, & Season System! Get the most out of limited seasons with popular themes. Check out the arena, roulette, season awards, and get a season pass in no limits drag games.TEAMSUnite with other players and reach the most elite Race League. Compete with strong race rivals and get awesome rewards. Use Boosters to keep team rank position and move higher to tops.THE ULTIMATE DRAG RACE GAMES EXPERIENCE- Stellar graphics- A phenomenal collection of 18 wheeler trucks- Daily events and competitions to win prizes- Endless truck modifications and upgrades to decide on- Trailer modifications and more- Create your truck from scratch and have it look how you want it to- Win races and gain street cred as one of the best- Complete missions given for quick cash- Collect an assortment of different brands and drive in your absolute favorite!- Drive in the classics!- Show off your best times!Don’t forget to follow us! Win races and make friends along the way:Facebook: https://www.facebook.com/BigRigRacingGame/Instagram: https://www.instagram.com/big_rig_racing_game/Reddit: https://www.reddit.com/r/Big_Rig_Racing_Game/Official Website: https://www.mobirate.com/",4.6,93000,5000000,Everyone 10+,Racing games,"Racing, Drag racing, Casual, Single player, Stylized, Vehicles, Truck, Driving"
254,Words of Wonders: Crossword,"Welcome to Words of Wonders! In this fantastic crossword game, you will improve your vocabulary and spelling skills at the same time you travel around the world discovering the hidden secrets of the 7 wonders and also incredible cities.In WOW you will start with few letters as an unique clue, you will have to test your brain to write and create new words from scratch and connect all of them to get the final crossword solution. Will you master this vocabulary game? Sometimes you will have the solution clear in your head, but sometimes you will have to guess the solution as there won't be more words to connect. This game is a perfect entertainment tool to improve and develop your searching, writing, and solving problem skills.Puzzle by puzzle you will travel around the world while solving every crossword and every challenge that may arise. Connect letters to get the final solution and travel to a new country! Is there any better than discovering the world while learning new words and improving your vocabulary?What strategy will you use? To solve the puzzle at a first sight by guessing or maybe by finding one word at a time? What will be the next city to quit from your bucket list? In this amazing crossword game, you will visit all of them!TEST YOUR VOCABULARYHow many words do you actually know? Your alphabet may be more limited than you think...or maybe not! These puzzles are challenging and will test how broad your vocabulary is, how you combine different options, and if you can search well enough to solve the jigsaw.FIND THE HIDDEN SECRETSThis crossword game will merge the needed skills you need to solve every riddle. You will need to master the vocabulary to go to the next levels. There are extra words to find on each level if you want to make a puzzle more challenging.DISCOVER NEW PLACESJoin the quest and enjoy your trip around the world to visit the seven wonders! Connect them with your knowledge and you will have advanced a lot. Each monument is unique and has a different letter to guess. You will learn new vocabulary but also you are learning about how wonderful the earth is at the same time! Will you be able to create a hidden sentence?BECOME A MASTERWords Of Wonders (WOW) will test your vocabulary as you discover the wonders filled with challenging levels. Begin your journey with the first wonder and climb your way up to reach the top. Each wonder and level will get progressively harder and will be unique, thanks to the game’s rich database. Connect the letters without lifting your finger, find the hidden words on the board!Enjoy the simple and beautiful game design and also the wide variety of levels and puzzles that will give you more fun during the play!Words Of Wonders (WOW) is a challenging word game from the makers of Wordz. Let the adventure begin!",4.9,5520000,100000000,Everyone,Realistic Games,"#9 top free word, Word, Search, Single player, Realistic, Miscellaneous, Puzzles, Modern, Offline"
255,My Home Design - Modern City,"Decorate your ideal NYC home 🎨🌃Welcome to Modern City, your new favorite home design game set against a stunning NYC background!Modern City provides new experiences for all those who wish to explore home design and to design beautiful interiors.Star interior designers Chloe and Liam are looking forward to working with you!Your clients, who are relying on you to help them renovate their homes, are excited to meet you. Meet several clients with different styles and show off your expertise in crafting stunning interiors with luxurious decor options!Obviously, it's not going to be easy to impress them. These clients have very different tastes and standards, which is why they need someone with a good eye for home design and decor style!Solve exciting and addictive puzzles to collect coins and use them to decorate your clients' homes with luxurious and exquisite furniture, decor items and more!Are you ready to completely transform your clients' homes? Transform simple houses into trendy and unique designer homes with your home design magic touch for decor!Here's how to do it:🛠️ Meet interior designers Chloe and Liam. Couples, singles and families, all kinds of clients are waiting for you!🛠️ Design, renovate, remodel kitchens, living rooms, bedrooms and more in Modern City! Simply tap to start creating trendy interiors!🛠️ Exciting and addictive Match-3 puzzle games! Make sure to try out the newest levels!🛠️ Enjoy witty and fun conversations among interior designers and clients!🛠️ Meet various clients and nurture your interior design and decor skills!🛠️ Enjoy Modern City for free!🛠️ New episodes and match-3 puzzle levels are revealed every week!Have you ever dreamed of the perfect city life? What about becoming a star interior designer?All these clients need your design skills and are waiting for you in Modern City!Play now!*Please note that [ Modern City ] saves your progress on your device. Data will be reset if you delete the app or change your device.*------------------------------------------------Are you into home design? Puzzle games?Explore your passion for decor in My Home Design - Modern City!",4.6,631000,50000000,Everyone,Realistic Games,"Puzzle, Match 3, Match 3 adventure, Casual, Single player, Realistic, Renovation, Miscellaneous, Puzzles, Offline"
