game_id,game_name,description,score,ratings_count,downloads,content_rating,section,categories
161,Klondike Adventures: Farm Game,"Welcome to Klondike! It is not just a farm game simulator 🐏; it's a thrilling world of expeditions during the Gold Rush era, filled with mysteries and unexpected discoveries! 🌄Are you dreaming of an exciting adventure? 🎒 Do you like traveling to odd places? Enjoy renovating abandoned spots? Or maybe you just want to take a break and play a relaxing mini-game and build your farm?Klondike has it all! Complete tasks, build houses and factories, grow crops, and raise livestock! Help Kate and Paul build their dream farm!Exciting adventures and themed events await you. Leave your farm and explore new areas where you can find real treasures! 🤩Klondike features:- 💫 Unique gameplay: develop your farm, landscape the territory, construct buildings, produce valuable resources, fulfill orders, explore new areas, and find real treasures.- 🏘 Regular themed locations and events: exciting adventures await you in mysterious and dangerous corners of the world. If you do not want to stay on the farm, embark on a journey through the wilderness, explore enigmatic ruins, and uncover the secrets hidden in the depths of these amazing places.- 🎯 Engaging tasks: build various farm buildings, grow and harvest crops, and raise animals to provide everything your farm needs! Trade with neighbors and unlock new locations! Complete numerous tasks, meet fascinating characters, restore the farm, and unravel the secrets of the surrounding lands.- 👨🌾 Colorful characters: get to know their fascinating farming stories; help the heroes overcome all the challenges.- 🏆 Captivating mini-games: play fun mini-games at your farm and in other locations! Complete tasks between expeditions! Receive valuable gifts and prizes.- 🏔 Breathtaking landscapes: enjoy the stunning scenery and landscapes of various locations! Your small northern farm is filled with wonders of nature and history in every corner! You can explore the terrain for hours. The game's graphics are top-notch, and every element of the world is crafted with great love. The wild lands and the atmosphere of gold mining beckon you to embark on a journey with the main characters!Klondike is a free farming game, but some in-game resources can be purchased with real money. Internet connection is required to play and participate in competitions.Klondike is not just a farm game; it's a whole world that you can explore, develop, and make your own. Immerse yourself in an exciting journey, become the owner of an incredible farm, and commence your journey as a gold seeker! Travel back to the days of the Gold Rush and begin your adventure right now!By downloading this application, you agree to Vizor Games’ User Agreement and Privacy Notice.Under our User Agreement and Privacy Notice, only persons of 18 years of age or older may download and play Klondike Adventures.PLEASE NOTE: Klondike Adventures is free to download and install. However, some game items can be purchased for real money. If you do not want to use this feature, please set up password protection for purchases in the settings of your Google Play Store app. Additionally, a network connection is required to play.Privacy Notice: https://vizor-games.com/privacy-notice/User Agreement: https://vizor-games.com/user-agreement/",4.6,1300000,50000000,Everyone,Explore games on PC,"#1 top grossing simulation, Simulation, Management, Farming, Casual, Single player, Stylized, Restoration, City"
162,DesignVille: Merge & Design,"Dive into a story full of fun characters, complete renovation orders from different clients, create a unique design for each room, decorate how you want and let your creativity run wild! Make your dream come true: build and expand the biggest and best remodel studio in DesignVille! Complete a lot of design projects and home makeovers in this ultimate home decor game.Why you'll love DesignVille:● Awesome graphics and detailed animations: enjoy stunning visuals and intricate animations that bring your design projects to life.● Fun and easy to learn merge puzzle gameplay: match, merge, and combine tiles to craft better tools and rare, unique items in this free merge game.● Relaxing and satisfying experience: clean up game board and rearrange tiles for relaxing, satisfying and destressing experience.● Generous rewards and new combinations: level up, earn generous rewards, and unlock exciting new combinations as you progress in this room design game.● Creative freedom: with no rules holding you back, you can arrange your rooms however you want, decorate gardens, renovate mansions, and create the designs of your dreams!● Vast selection of furniture and decorations: choose from a huge array of furniture and decorations in every style imaginable, perfect for any home decor enthusiast.● Engaging plot and fascinating characters: Complete design orders, look for new clients, meet cool characters, and manage your very own design studio business!DesignVille welcomes anyone who are interested in home decoration, interior design, manor renovation, remodeling, gardening, home improvement and other exciting design related things! You will get a lot of design ideas and inspiration in our game.Features:- Engage in fun and creative gameplay as you design and decorate each room to perfection. DesignVille offers the best house decorating games experience, allowing you to transform spaces with your unique touch.- Transform spaces into beautiful masterpieces with a wide range of design options. Whether you’re into home design or room design, this game has got you covered.- From cozy rooms to grand mansions, DesignVille covers all aspects of house design and room decor. Dive into the ultimate room designer experience and see your house design dreams come to life.- Perfect for fans of home design games, offering endless possibilities for creative expression. Whether you’re a home or room designer, DesignVille’s game will captivate you.- Incorporate dress up elements to add a personal touch to your characters. This dress up game component adds a fun twist, making DesignVille not just about room decor, but also about styling your characters.- Play match 2 puzzle games to earn money, which you can use to buy the things needed to renovate your office, garden, home, house, and mansion.Please join us if you like to decorate house, solve puzzles, find combinations and matches, combine items, and enjoy a fun and exciting storyline with charismatic and memorable characters! Dive into DesignVille today and start transforming spaces into masterpieces.",4.6,61300,5000000,Everyone,Explore games on PC,"Puzzle, Merge, Casual, Single player, Stylized, Offline"
163,Hungry Shark Evolution,"Dive into the official game of Shark Week with Hungry Shark Evolution! Become the ultimate predator in this offline shark game where you’ll rule the ocean and eat your way through an underwater world of adventure 🦈🦈🦈🦈Take control of a mighty, hungry shark and survive as long as possible by eating everything in sight! In this thrilling, classic arcade-style shark game, evolve your predator into a fierce sea beast, from Great Whites to the ferocious Megalodon, and explore the ocean’s depths filled with fish, animals, and other creatures.Unleash Your Predator Potential!It’s eat or be eaten in this shark evolution simulator where your mission is simple: evolve and survive. Start as a small fish and work your way up the ocean’s food chain, evolving your shark through multiple levels until you dominate the underwater world! Hunt, eat, and attack whales, fish, birds, and more. This offline game lets you explore without Wi-Fi while keeping the action going.Equip Powerful Gear and Accessories!Boost your shark with awesome accessories like jetpacks, lasers, and even fancy hats! Equip your shark to swim faster, bite harder, and survive longer as you navigate the open world.Meet Your Baby Shark Companion!Need help exploring the open world? Recruit baby sharks to join you in the hunt! Each baby shark offers unique abilities to assist you on your journey. Evolve your sea animal and watch your baby shark’s powers grow with you as you dive deeper into the shark evolution game.Survival of the Hungriest!The ocean is full of surprises and challenges. As a shark in this offline game, it’s your job to keep eating and evolving. Be wary of dangers lurking in the deep, but know that each meal makes you stronger. Take a bite of everything and discover the thrill of survival in a classic retro shark game!Game Features:•Play as one of many different sharks and animals, including iconic predators like the Great White, Hammerhead, and Megalodon.•Dive into an open world of fish, animals, and prey, hunting for your next meal as you evolve in size and strength.•Collect and evolve over a dozen unique fish, sharks, and baby sharks, each bringing a new layer of strategy to your journey.•Equip powerful accessories like jetpacks, lasers, and top hats to customize your shark and make it the ultimate predator.•Activate Gold Rush to extend survival and score big points in this arcade-style shark game.•Intuitive controls let you tilt or tap your way to becoming a legendary sea predator.Additional Information:This game contains in-app purchases for Gems and Coins to enhance gameplay. You can also earn Gems and Coins in-game or by watching ads. This game remains fully playable offline!Join Our Community!•Facebook: HungryShark•X (Twitter): @Hungry_Shark•YouTube: @HungrySharkGames•Instagram: @hungrysharkFeedback & Support:If you need help or have feedback, visit our support page: Ubisoft Support",4.5,7620000,500000000,Teen,Explore games on PC,"Action, Action-adventure, Survival, Arcade, Single player, Stylized, Animals, Shark, Ocean, Offline, Play Pass"
164,Open House: Match 3 puzzles,"Beat colorful match-3 levels to renovate and decorate rooms in the mansion, unlocking ever more chapters in the exciting friend's story along the way!The game features:● Unique gameplay: help friends renovate the house by swapping and matching pieces!● Interior design: you decide what the house will look like.● Exciting match-3 levels: tons of fun, featuring unique boosters and explosive combinations!● A huge, beautiful mansion: discover all the secrets it holds!● Cute pets: meet а fluffy cat and naughty parrot!● Invite your friends to help you create your own cozy atmosphere in the house!Give the old mansion a complete makeover! Show off your designer skills by furnishing and decorating the kitchen, hall, orangery, and other house areas, including the garage! Thousands of design options will give you maximum freedom to explore your creativity, change designs any time you want, and eventually create your dream house!Open House is free to play, though some in-game items can also be purchased for real money. If you don't want to use this option, simply turn it off in your device's Restrictions menu.Best regards,Integra Games team",4.6,78900,5000000,Everyone,Explore games on PC,"Puzzle, Match 3, Match 3 adventure, Casual, Single player, Stylized, Miscellaneous, Puzzles, House & garden, Offline"
165,Ski Resort: Idle Tycoon & Snow,"Welcome to Ski Resort: Idle Tycoon & Snow – Build Your Winter Empire!Embark on an exciting adventure in the snow-covered paradise of Ski Resort: Idle Tycoon & Snow! Take control and build your very own ski resort tycoon empire to become the ultimate idle manager of winter resorts.From humble beginnings to a bustling winter destination, transform your resort into a thriving snow-covered metropolis. Earn idle gold even when you’re away, and reinvest it to grow your ski resort, attracting even more guests and VIP visitors. Expand and upgrade your businesses, from cozy bars to luxurious ski rental shops, to keep guests delighted and watch your earnings skyrocket. Draw in VIPs for exclusive rewards and revenue boosts that accelerate your empire’s growth.Immerse yourself in stunning visuals that bring the snowy mountain slopes to life, creating a relaxing winter atmosphere that’s perfect for fans of casual idle games. With offline play, you can manage your resort anytime, anywhere. Enjoy intuitive tycoon gameplay as you unlock new upgrades, expand your ski facilities, and develop premium services to keep the visitors coming.In Ski Resort: Idle Tycoon & Snow, you can:⛷️ Experience a realistic ski resort management simulation where every decision impacts your success,🕹️ Enjoy the relaxing, casual style of an offline idle tycoon game,🏔️ Grow your idle empire and earn passive income even when you’re offline,🚁 Unlock and manage advanced services, giving you the edge in strategic development,📈 Build and expand a wide range of winter attractions, creating a stunning snow-filled playground.Join the adventure today and discover the endless possibilities of Ski Resort: Idle Tycoon & Snow! Can you build the ultimate winter getaway and become the top tycoon of the slopes?",4.2,15000,100000,Everyone,Explore games on PC,"Simulation, Management, Tycoon, Casual, Single player, Stylized, Low poly, Offline"
166,Turnip Boy Commits Tax Evasion,"Embark on a humorous adventure filled with action, puzzles and tax evasion. Meet cute talking vegetables and fruits, while also fighting massive animal bosses and dozens of different enemies in EPIC dungeons!Take control of an adorable turnip who happens to be an absolute menace to society. After failing to pay taxes and getting evicted from your home, you must go on an epic quest to pay back your massive debt to an onion mayor.During your journey, uncover what’s spoiling this garden community and rise to tear down the corrupt vegetable government!Key features:• A thrilling, single-player adventure full of tax evasion, petty crimes and more.• Dungeons full of puzzles, enemies and rare treasures to pay back your debt.• Battle massive beasts that terrorize the garden community.• Grow and harvest plants to aid in your journey.• A large cast of quirky food-based characters, all with their own stories and problems.• Tons of tax documents to rip up, allowing you to erase your paper trail and potentially destroy the government.• Earn collectible hats and alternate between which one to wear.• Multiple endings based on how effectively you commit tax evasion.• A deep history of the world and how it became what it is.[The game requires a purchase in order to have access to the full game content. Only the demo version will be available for free.]© 2021 Snoozy Kazoo ©2022 Graffiti Games and Plug In Digital",4.6,25500,500000,Everyone 10+,Explore games on PC,"Action, Action-adventure, Casual, Single player, Stylized, Pixelated, Offline, Play Pass"
167,Grimvalor,"Slash your way through the hordes of darkness and defeat King Valor's fearsome guardians in this breathtaking RPG adventure!★ Play the first act for free! A single purchase unlocks the full premium game. ★(The free first act has 1-2+ hours of gameplay, which you can replay as many times as you want. Unlocking the full game allows you to continue further and experience all five acts.)""Chaining together a slick series of attacks, dodges, and jumps, is incredibly satisfying."" — PocketGamerA malicious power stirs in the forgotten kingdom of Vallaris. Tasked with discovering the fate of its lost king, your quest quickly takes a sinister turn and you are cast into darkness. Surrounded and outnumbered, you must grab your sword, steel your temper and fight your way through a land that does not welcome you. Except for the friendly merchant - he's grateful for your business.Grimvalor is a challenging hack & slash platformer with fast-paced combat in a dark fantasy world. Take control of a lone warrior on a quest to restore a corrupted realm. Embark on a journey through atmospheric landscapes and dungeons in a massive story-driven premium experience.Master skill-based combat, learn enemy patterns and bring them down with all your fury. Explore the shattered lands of Vallaris, find and upgrade equipment and level up your character. Face the legacy of King Valor's madness and prevail!☆ Supports Android Game Controllers☆ Accurate and customizable touch controls☆ Epic boss fights☆ Stunning 3D visuals optimized for a variety of Android devices☆ Uses Play Saved Games to keep your saves in sync between devices☆ Play offline - perfect for commute",4.7,121000,5000000,Teen,Explore games on PC,"Action, Platformer, Hack & slash, Single player, Stylized, Fantasy, Dark fantasy, Intense, Offline, Play Pass"
168,Summoners War: Chronicles,"Summoners, unfold your chronicles!The beginning of a summon RPG, ""Summoners War: Chronicles"".《 Arena Overhaul 》- Hero Areas are coming to the World Challenge Arena! Gain unique buffs across various areas!- The Brawl Arena ban system has been revamped! Diversify your strategy and secure victory!- Aim for the top ranks in the Arena to obtain the Radiant Phoenix and Magitech Dragon Rides!《 Rock Star World Tour Event 》- Collect Rock Star's Power Chords to go on a World Tour and get a BGM!《 Game Introduction 》■ Seize the victory! Experience a fierce world of battlesForm your own strategy with a variety of dazzling skills and attributes.Achieve thrilling victories in exhilarating battles.■ Share precious moments with your charming MonstersMeet over 400 Monsters of diverse classes.Write your unique epic saga on your shining journey as a Summoner.■ Protect the peace in Rahil Kingdom with an immersive storyEmbark on adventures to protect the kingdom from the nefarious Galagon King, Tefo.Your story unfolds as you defeat powerful bosses and protect the kingdom.■ Endless challenges, boundless exploration, and various content await youTest your strength in PvP battles at the Arena.Join forces with allies to strive for the top guild in Guild Siege Battle.Experience the satisfaction of defeating threatening enemies in Dungeons.Unleash boundless possibilities in the world of Chronicles.***[App Permissions]We request access permissions to provide the following services when using this app:1. (Optional) Storage (Photos/Media/Files): We request permission to use storage for downloading and storing game data.- For Android 12 and below2. (Optional) Notifications: We request permission to publish notifications related to the app's services.3. (Optional) Nearby Devices: We request permission for Bluetooth usage on some devices.- BLUETOOTH: Android API 30 and earlier devices- BLUETOOTH_CONNECT: Android 12※ Services can still be used without granting optional access permissions, excluding the functionalities associated with those permissions.[How to Remove Permissions]You can reset or remove permissions after allowing them as shown below.1. Android 6.0 or above: Settings > Apps > Select App > Permissions > Allow or Remove Permissions2. Android 6.0 or below: Upgrade the operating system to remove permissions or delete the app※ If you are using Android 6.0 or below, we recommend that you upgrade to 6.0 or above as you can't change the optional permissions individually.• Supported Languages: 한국어, English, 日本語, 简体中文, 繁體中文, Deutsch, Français, Русский, Español, Português, Bahasa Indonesia, ไทย, Tiếng Việt, Italiano• This app is free-to-play and offers in-app purchases. Purchasing paid items may incur additional fees, and payment cancelation may not be available depending on the type of the item.• Conditions regarding the usage of this game (contract termination/payment cancelation, etc.) can be viewed in the game or the Com2uS mobile game Terms of Service (available on the website, https://terms.withhive.com/terms/policy/view/M330).• Inquiries regarding the game can be submitted via Com2uS Customer Support 1:1 Inquiry (http://m.withhive.com > Customer Support > 1:1 Inquiry).• Minimum specifications: 4GB RAM***- Official Brand Site: https://summonerswar.com/en/chronicles?r=p2- Official Forum: https://community.summonerswar.com/chronicles- Official YouTube: https://www.youtube.com/@SummonersWarChronicles",3.5,30500,1000000,Teen,Explore games on PC,"Role Playing, MMORPG, Multiplayer, Competitive multiplayer, Single player, Stylized, Anime, Fantasy"
169,Awaken: Chaos Era,"Enter the mythical world of Awaken, an ancient land held together only by the elements that brought it into existence. Peace is now being torn apart as the former King has disturbed the balance and brought the continent to the brink of destruction. As the constant struggle between light and darkness wages on, It's time to join the battle and awaken your inner hero!▲Collect powerful heroes and assemble the right combination to dismantle your opponent!▲Get lost in an immersive story with captivating 3D artwork as your heroes unleash a variety of attack effects and skill animations!▲All heroes have unique abilities that can give you an edge over your enemies. When you step onto the battlefield, strategy and skill reign supreme!▲Uncover the mysteries of Awaken and explore a narrative storyline filled with hero origins as you follow Evelyn on her journey to find her father and restore peace to the land.▲Climb the arena rankings in fast-paced PVP action, crawl through rogue-like dungeons, challenge tough guild bosses, track down wanted heroes to claim bounties, and much more!The battle awaits:Facebook: https://www.facebook.com/AwakenChaosEraDiscord: https://discord.gg/GZRcaD8",4.3,72600,1000000,Teen,Explore games on PC,"Role Playing, Turn-based RPG, Multiplayer, Competitive multiplayer, Single player, Stylized, Fantasy, Medieval fantasy"
170,Luna Re : Dimensional Watcher,"[Luna Expedition]'s Great Dimensional Rift Adventure- This is a ‘Collectible RPG’ taking place in a location called the Stonia continent. After the Dimensional Rift, desperate battle between Humans and monsters from the world began.- You must stop Peter’s plan to engulf the world with darkness.- Create a party with various companions to explore the enormous map and obtain powerful Equipment to become stronger.- We introduced a Crossroads system to this game allowing users to have a high degree of freedom. This allows the user to proceed in their desired direction to explore every nook and cranny of the enormous World Map.",3.8,5490,100000,Everyone 10+,Explore games on PC,"Role Playing, Tactical, Casual, Single player, Stylized, Anime, Monster"
171,Blade Idle,"It’s a story of a common herb collector who stumbles onto a legendary sword and become a great hero.Adventure through the main stages and dungeons, and grow your character through farming.Features- Customizable Skill System. Obtain and use various skills- Merge System. Get even more powerful grade equipment- Challenge normal and special dungeons and collect growth materials- Grow your character through the Pet, Relic, and Insignia System- Challenge the Upgrade Dungeon and collect various skins※ Note: The server you are connected to is based on your device language setting. If your device language is set to Korean, you will connect to the Korean Server. All other languages will be connected to the Global Server. Please keep this in mind when you download the game.Help : cs@mobirix.comHomepage :https://play.google.com/store/apps/dev?id=4864673505117639552Facebook :https://www.facebook.com/mobirixplayenYouTube :https://www.youtube.com/user/mobirix1Instagram :https://www.instagram.com/mobirix_official/TikTok :https://www.tiktok.com/@mobirix_official",4.2,79500,1000000,Everyone 10+,Explore games on PC,"Role Playing, Idle RPG, Multiplayer, Competitive multiplayer, Single player, Stylized, Anime, Warrior"
