game_id,game_name,description,score,ratings_count,downloads,content_rating,section,categories
83,Road Trip: Royal merge games,"Casual Adventure Game! Mobile Application Adventure Game. Casual Adventure in your pocket! Road Trip: Royal merge Adventure Games is an Adventure Game about traveling through the world of secrets and mysteries! World with a unique history and events awaits you!Mobile application Road Trip: Royal merge Adventure games is a mobile application that is always with you in your mobile device. Mobile game is an Adventure for the whole family. Road Trip is a whole Klondike Adventure! Real family island with different locations and mysterious places. Casual Adventure game is waiting for you!Our Road Trip game is a unique township of story-driven Adventures and journeys. Merge items and have fun with the events!Journey through our game will introduce you to Alex, the main character of this story!Join Alex, an aspiring designer, on a journey to discover the secrets of unexplored lands!🧩 Merge items Alex and her friends desperately need in their Adventure!🔍 Visit the unusual locations of the 1980s and enjoy their authentic architecture and interiors!✅ Complete quests to advance in your travels with Alex and earn fantastic rewards!🧩 Solve challenging puzzles encountered along the way!🙋♀️ Many colorful characters, different backgrounds, professions: cooks, mechanics, gallery owners, adventurers, shamans and scammers. Many animals - for each location of our game Road Trip!🌍 30+ locations with different geographical settings: empty ones are replaced by mountain peaks, snow forests, tropical islands! Urban landscapes with wild thickets, jungle - all this is available in our mobile game Road Trip: Royal merge adventure! Real road Adventure with a constant change of scenery outside the window.👽Each chapter is a separate living world, a reference to a certain American state and iconic places like Roswell and UFOs and the like!💕 Each location is a small story. Our game Road Trip gives freedom of genres and moods: there are action-packed adventures in the jungle, traps and crocodiles, mystical ghosts of the Hawaiian Islands, chases and bizarre mechanisms, reality TV shooting (intrigue, investigation), dates and balloon flights. Treasures and architectural puzzles, caves and ancient civilizations! Love line and a triangle in the fight for the heart of our heroine Alex!😀Setting in the spirit of 1960-1980 blurred timelines, lack of modern gadgets, nostalgia for a bygone time!🕹 Road Trip: Royal merge adventure games has a huge number of different mini-games! Play for fun!⚙ Every month there is an update with new mechanics/time events. We release a new location every week!🏆 Event Expeditions, time-limited expeditions with new mechanics in the merge! Treasury rooms, crafting, garden beds, energy generators at the location, tournaments, season pass, wheel of Fortune!Road Trip township game is a matching puzzle merge adventure game! Game of merge items for the whole family. Play our relaxing puzzle merge game. You’ll match and merge items, solve puzzles. You can play our Road Trip township game without internet!The great merge township journey is about to begin! Have fun exploring the worlds of Road Trip!🗺",4.6,40500,1000000,Everyone,Casual games,"Puzzle, Merge, Casual, Single player, Stylized"
84,Spider Solitaire,"Spider Solitaire combines the original rules of one of the most popular classic card games with a set of exciting features. Enjoy a whole new experience with your favorite solitaire card game, brought to you by the game experts of a top developer! Challenge your mind by playing classic spider solitaire, reach higher stages with every consecutive win and beat your high score!Spider Solitaire highlights:- Classic spider solitaire gameplayStack the cards of a suit in descending order (from King to Ace) to solve free solitaire spider games. Adjust the solitaire difficulty level by playing with 1, 2 or 4 suits.- Keep your mind activeTrain your brain and practice your focus and patience to reach higher stages in this solitaire card game and earn as many points as you can. Complete daily challenges and seasonal events playing classic spider solitaire.- Relax and unwindFlip the switch from the daily grind to a relaxing pastime with free spider solitaire. Play card games during your breaks or after a long work day wherever you are on your mobile device. Become a spider solitaire master!Spider Solitaire features:- Various difficulty levelsChoose the number of suits - 1, 2 or 4 - to adjust the spider-solitaire card game to your experience and have as much fun as you want. Play solitaire anytime, anywhere!- StagesMaster your strategy to win classic spider solitaire games, move to higher stages and beat your best score! The higher the stage you reach, the more points you get for moving the cards correctly. Set your own record in spider solitaire game!- Seasonal EventsReveal unique pictures while playing solitaire card games of several difficulty levels. Play free Spider Solitaire, complete Seasonal Events and build your own collection of specially crafted postcards!- Daily ChallengesEarn trophies every month by playing spider solitaire challenges every day.- Customizable solitaire cards and backgroundsChoose from a variety of themes to help you keep focused and enjoy free spider solitaire games.- Hints and undosMade a wrong move or unsure what to do in a classic spider solitaire game? Smart Hints and Undos will have you covered!- Simple tap or drag controlsEnjoy the smooth spider solitaire experience by simply tapping or dragging cards.- Auto-saveContinue playing classic spider solitaire free game where you left off.- Left-hand modeA special interface for left-handed people to comfortably play spider solitaire free card games!Train your brain with card game and have limitless fun on the way to beating your high score in spider solitaire games!Terms of Use:https://easybrain.com/termsPrivacy Policy:https://easybrain.com/privacy",4.3,105000,10000000,Teen,Casual games,"Card, Solitaire, Spider solitaire, Casual, Single player, Realistic, Miscellaneous, Cards, Peaceful, Offline"
85,Fishing Clash: Sport Simulator,"Have you ever had fish on your brain, but you couldn't go to your favorite fishing spots? Catching fish wasn’t fun enough in some casual fishing games? Play Fishing Clash – a free realistic fishing simulation game chosen by millions of anglers!Fishing Clash mixes the best features of multiplayer fishing games: the realism of simulator games, the competitiveness of sports games & the social aspect of fishing and hunting apps. It's like a fishing forecast app in the virtual world where every angler can compete with others. Offering various fishing spots worldwide, it's the most realistic multiplayer simulation game amongst free fishing games.• Launch the game.• Tap the cast button in the bottom-right corner of the game.• Keep tapping the strike button continuously to ensure the line tension indicator is in the top bar center.• Enjoy the look of the fish on your hook!• Start catching more fish or win duels in pvp game mode.• Take part in multiplayer challenges and championships.• Win Lure Cards and upgrade them to level up and unlock new fishing spots!From Florida Coast & Kenai River to Lake Biwa, Galapagos & Loch Ness – in this multiplayer simulation game, you can find a fishery almost everywhere globally and lots of different fish like bass, carp, trout, shark, and even some monster fish from the Deep Sea.Collect lure cards like in CCG & upgrade them to catch bigger fish! The greatest ones let you win competitive multiplayer games, master angler & world cup tournaments – that's something you won't find neither in free fishing apps nor in the other multiplayer fishing games!Feel the thrill of multiplayer games and play a fishing duel against other anglers. You need skills to catch a fish and brains and strategy to win duels. Master skills & win every multiplayer fishing battle in the pvp game mode.Visit different fishing spots & hunt for amazing rewards like new rods, Lure Cards, and skill tokens. Pass the fishing trial, challenge angry sharks, become a catfish hunter or a traveler catching the biggest fish on a few different fishing spots!Although Fishing Clash is a simulator at its heart, it enables ways to socialize like in free fishing apps. Meet fellow anglers, exchange lure cards for different fishing spots & work together for great rewards in multiplayer Clan Wars.All fishing spots have their skill tree. Use skill tokens to unlock new skills and get bonuses to particular fish species, fish rarity, and more! Advance to fishing master league while competing in different pvp game modes.Whether you prefer flick fishing, ice fishing, or trolling, you'll admire the look of all fishing points. Every fishery in Fishing Clash features beautiful 3D vistas and hand-crafted fish you'll love to see on your fishing hook. It's a realistic simulator, after all.New fish, new fishery, new rods – in this realistic simulator, you can find new content every week as there's no shortage of fish to catch!Whether you're a seasoned fish angler or casual multiplayer games fan, Fishing Clash is a great choice. With tens of fishing spots worldwide and hundreds of fish species, it offers one of the best experiences among free fishing games. Don't look for any other free simulator. DOWNLOAD NOW and catch the trophy fish, angler! Game on!",4.7,1830000,100000000,Everyone,Casual games,"Simulation, Fishing, Casual, Single player, Realistic, Experiences, Beach"
86,Cricket League,"Bat, bowl and field your way to the top of the league in this fast, fun, exciting and authentic 3D real-time multiplayer Cricket game.Play quick two over matches against your friends or players around the world in just a few minutes! Ready..Set..Start your own Cricket saga now!FREE Online Cricket Game!🏏 3D Multiplayer Cricket Sports Game🏏 Easy to learn Batting and Bowling🏏 Win matches to get coins and build your dream team!🏏 Play with your friends and family!🏏 Create your team and top the leaguesTravel all over the world playing against the best cricketers from the best pitches all over the world where the top ODI,T20 matches have taken place:Mumbai | Karachi | Adelaide | Dubai | Johannesburg | Dhaka | Melbourne | LondonPlay an amazing mobile version of the Cricket sport!Game Features :🏏 Play Quick 2 Over matches in 3-5 mins!🏏 Learn Cricket controls in under a minute!🏏 Play with your friends from around the world.🏏 Unlock the dream team and battle to reach the highest level.🏏 Collect over 25 characters!🏏 Level up your players to unlock new ways to play🏏 Buy new types of balls to increase your chances of winning!🏏 Play with awesome deliveries like Doosra, Sling, In/Out Swings🏏 Compete in leagues and become the master team in this great sport!🏏 Play in multiple different locations around the world like India,Bangladesh, England, Australia and South Africa!🏏 Unlock new locations to win even more coins!🏏 Stick to the best strategies and match with the best players!🏏 Super Smooth gameplay even on a 2G/3G network!This game includes optional in-game purchases (includes random items)Don’t miss out on the latest news:Like Miniclip: http://facebook.com/miniclipFollow us on Twitter: http://twitter.com/miniclip------------------------------------Find out more about Miniclip: http://www.miniclip.comTERMS AND CONDITIONS: https://www.miniclip.com/terms-and-conditionsPRIVACY POLICY: https://www.miniclip.com/privacy-policy",4.7,2390000,100000000,Everyone,Casual games,"Sports, Cricket, Casual, Multiplayer, Competitive multiplayer, Stylized, Sports"
87,YAHTZEE With Buddies Dice Game,"Welcome to Yahtzee® with Buddies! The classic dice game reimagined for mobile!Roll the dice and experience Yahtzee® like never before. Challenge your friends and family, compete in tournaments, and complete exciting missions to earn amazing rewards! Join millions of players worldwide online and embark on your dice adventure today.Experience the classic dice game reimagined in Yahtzee® With Buddies!Do you love playing board games like Monopoly, Scrabble, Phase 10, Farkle, Yams, Yazy, or Yatzy? Are you a puzzle game fan who enjoys free apps on your phone? Is having fun with timeless dice games your dream? Then you've come to the right place!Roll into Fun with the classic dice game on the go!Play the official mobile version of Hasbro's classic dice game, Yahtzee®! Roll the dice anytime, anywhere, in solo play or face off against friends and family in exciting multiplayer modes.Download now to receive 30 free bonus rolls and start your adventure!⭐ Top Features: ⭐✅ Play for FREE with friends around the world! 👯✅ Compete in online tournaments to reach the top and win huge jackpots! 👊✅ Discover exciting features that add a fun twist to classic Yahtzee® gameplay! 🎲✅ Join a Yahtzee® Family and engage in thrilling blitz competitions! 😈✅ Challenge and defeat Dice Masters to unlock dream like rewards! 🎉✅ Chat, send stickers, and collect card packs as you play! 🔷✅ Personalize your game with custom dice, new portrait frames, and themed boards galore! 🤩If you love classic dice game app like Farkle, Phase 10, Yatzy, Rummikub, or Yazy, then you'll love Yahtzee® with Buddies app! Download the ultimate dice game for FREE now and join millions of players rolling the dice app worldwide!Challenge the Dice Masters 🌎Dive into fast-paced blitz games and unlock rewards as you play!Collect exclusive vanity rewards to customize your experience and make your dice dreams come true!Experience Multiplayer Fun!Play with Friends and Family—Build your In-game family to share help and rewards!Join exciting multiplayer matches with players worldwide in thrilling competitions!Dive into Yahtzee® Survivor—Compete in real-time blitz matches against hundreds and Win Big!Chat, Challenge, and Cheer with the New Social Buddies System!Expand your circle—Make new friends and earn extra rewards!Endless Ways to Win!Paint n Roll – Unleash your creativity! Roll Yahtzee® combinations to collect paint drops and create your own masterpieces.Prize Climb Bowling – It's not just bowling; it's rolling! Roll Yahtzee® combos to propel your ball down the lane. The more points you earn, the faster your ball goes!Collections – Collect stickers, complete sets, and unlock new dice!Thrilling New Tournaments!Experience a whole new level of excitement with our latest online tournaments. Dive into Solitaire, Bingo, and Stars modes—fun and fresh twists on classic dice games you love!Climb the ranks as you play through leagues and aim for the top spot to win exciting prizes.Win free bonus rolls and gain the edge over your opponents!There might be thousands of ways to play dice games like Yatzy, Crag, Balut, Yams, Farkle, or Kniffle, but there's only one authentic dice app: Yahtzee® with Buddies. Roll the dice to discover why millions have loved this classic game for over 50 years—dice dreams now available on your phone!Shake, score, and shout 'Yahtzee!' not Yatzy or Yazy. Challenge your friends and family in the classic dice game now on mobile. Roll your way to victory anytime, anywhere, online!HASBRO and YAHTZEE names and logos are trademarks of Hasbro. © 2024 Hasbro, Pawtucket, RI 02861-1059 USA. All Rights Reserved. TM & ® denote U.S. Trademarks.",4.3,282000,10000000,Everyone,Casual games,"#3 top grossing board, Board, Dice, Casual, Multiplayer, Competitive multiplayer, Single player, Realistic, Miscellaneous, Board games, Fantasy"
88,QuizzLand. Quiz & Trivia game,"QuizzLand is an entertainment trivia game where you get unlimited questions that can’t be found anywhere else.Install QuizzLand and answer trivia questions, read interesting explanations, educate yourself.This stress-relieving trivia game will take your mind off daily troubles and help you relax.Just your brain and our quizzes. No need to wait for other players' replies!QuizzLand is available in the most spoken languages. If you want the game to be translated into your native language, you’re welcome to share your suggestion with us at contact@quizz.land.Earn coins for correct answers and spend them on hints for the most challenging questions.Join the league of the smartest players and collect achievements of all kinds.Invite friends and get rewarded!QuizzLand is:-a fun trivia game to test your IQ and general knowledge-entertaining questions for all categories of interest-a relaxing game, which is also a source of valuable and little-known information-a great opportunity to challenge your friends and other players for highest ranks-delightful learning experience whether you know the answers or not-a game to help you fall asleep or to start your day with-detailed explanation for every questionIt’s nothing like other educational and anti-stress games: QuizzLand makes learning easy and relaxes your mind at the same time!*******************************How to play-check your knowledge: answer questions, read descriptions for correct answers and compete with other players.-to complete a level, you have to find the exit in a trivia maze.-you get points for each question answered correctly. If you give a wrong answer, no points are added to your account. Moreover, each wrong answer takes one of your lives. Your lives are displayed in the upper left corner of the screen.-if you continue playing after finding the exit, you will get more points for each question answered correctly.Questions:-all questions are filtered by difficulty. The more questions you answer, the more difficult questions you get. The difficulty of a question is indicated by white scales under each question.-you get more points for difficult questions.Coins and lives:Coins are the in-game currency used in QuizzLand. Use coins to buy lives, hints and other useful options.-if you want a larger amount of coins, you can make such a purchase in QuizzLand Store. To open the Store, tap on the cart icon in the upper right corner of the screen.-earn coins without buying them: collect your daily coin bonus, watch suggested videos or get coins by playing mini-games inside the maze.-you also get coins once the level is completed. In this case, the number of coins depends on how many questions you answered correctly.-your lives refill in a few minutes but you can also get them faster for coins. You can also get lives if you watch a suggested video.Question hints:“Double Chance” - activate the hint, then choose the answer. If it is incorrect, then you'll be able to try to answer again.“Fifty Fifty” - eliminate two incorrect answers in a question.“Majority Vote” - see what answer option the majority of players have chosen.“Skip Question” - activate the hint to skip a question and answer another instead.Map hints:“Show Exit” can be used to find the exit from the maze.“Flip Tile” allows you to flip any of the unopened questions.“Open Map” will flip all the tiles in the maze at once.Mini memory games:-these short calming games are available after each level - just in case you need a little refocus-play bonus memory games and earn more points. These brain games were created to train your concentration, memory and attention skills.-you can finish a memory game any time you like, however if you do it before the time is out, your reward will be smaller.",4.8,1570000,100000000,Everyone,Casual games,"#7 top free trivia, Puzzle, Brain teaser, Brain training, Multiplayer, Competitive multiplayer, Single player, Realistic, Miscellaneous, Puzzles, Fantasy"
89,Darts Club: PvP Multiplayer,"Darts Club is a PvP multiplayer game with a collectible twist!😃 Increase your dart skills, collect new pieces to 💪upgrade your darts💪 and take on players from around the world!😃 Join the ultimate club for online games and sports games!Experience the thrill of realistic games in this multiplayer sensation! Whether you're into 2 player games, PvP games, or simulation games, Darts Club offers an unmatched experience that combines skill and strategy. Challenge yourself in 1v1 matches or join multiplayer games for intense competition. Hit the bullseye in our dart games and climb the ranks in the Players Club. Feel the fury of a perfectly aimed shot as you dominate the leaderboard! This PvP multiplayer elevates the excitement of multiplayer games to a whole new level!Features:💥 PVP MULTIPLAYER: Find and defeat 👊 opponents in thrilling 1v1 matches!💥 INTRICATE UPGRADE SYSTEM: Find new pieces to strengthen your dart and become a master challenge games champion!💥 MULTIPLE DETAILED VENUES: Unlock 🔑 them by advancing in the ranks of this realistic game!💥 SPECIAL EVENTS & MORE: Uncover the surprises we've designed for you in this engaging simulation games adventure!Compete against other people online in this uniquely involving Darts game! Learn to throw your dart efficiently and precisely, master your skills and become a 💥Worldwide Dart Champion!💥 Hit that bullseye and dominate the Players Dart Club! Collect furry, eye-catching and vibrant dart flights to customize your strategy and enhance your gameplayBy playing the game and winning matches you 🔑unlock new pieces🔑 and can use them to 😃customize your darts!😃 With new barrels, shafts and flights your darts will get a unique look and a performance boost in 😆multiplayer PvP clash!😆 It's like 8 ball pool or snooker, but with darts!As your equipment becomes better, so do your chances of winning, but the deciding factor will still be 💥your skill💥. Even the best darts won't help you if you don't master the art of throwing them! Practice makes perfect, just like in archery or bowling games.The more you play, the better you'll be able to anticipate where the dart lands when you throw it. Don't give up, discover your inner Dart Champion and 👊dominate👊 the multiplayer PvP online arena! It's more exciting than cricket darts or a simple dart scoreboard!Challenge your friends in this amazing 2 player games and sports games experience! It's one of the best games with friends you'll ever play. Keep track of your progress with our built-in darts scorekeeper and dart score system.Join the Darts Club community and experience the boom in online games! Whether you're into 4 player games or prefer 1v1 matches, we've got you covered. It's not just another dart game, it's the most realistic master challenge games!For fans of juegos de mesa, this is the perfect digital alternative. Enjoy the thrill of darts without the need for a physical dart board. Our simple darts interface makes it easy for anyone to jump in and start playing.Are you ready to join the elite beta club of Darts? Download now and start your journey to becoming a Darts Club champion!Join the Player Community on our social media platforms:Discord: https://bit.ly/ClubGamesOnDiscordFB: https://www.facebook.com/DartsClubOfficialIG: https://www.instagram.com/_club_games_/TT: https://bit.ly/ClubGamesOnTikTok",4.6,189000,10000000,Everyone,Casual games,"#10 top free sports, Sports, Darts, Casual, Multiplayer, Competitive multiplayer, Realistic, Sports, Competitive"
90,Train Miner: Idle Railway Game,"The ultimate idle adventure awaits! Embark on a unique journey where you'll master the art of resource management, strategy, and creativity. In this captivating idle game, you're in charge of constructing a dynamic train empire. Start by chopping down trees to clear land and gather essential materials. Then, dive into the heart of engineering as you build and customize your very own train from scratch.As you progress, merge various railway carriages to enhance your train's capabilities and aesthetics. Expand your empire by laying intricate railway tracks across diverse landscapes, connecting distant lands, and unlocking new possibilities. Collect a wide range of resources along your journey, each playing a crucial role in growing and upgrading your train empire.Train Miner offers a seamless blend of simplicity and depth, perfect for casual gamers and strategy enthusiasts alike. With its intuitive gameplay, you'll find yourself effortlessly immersed in the world of trains, resources, and endless exploration.Game Features:- Dynamic Train Building: Customize and build your train from a variety of parts and designs- Resource Management: Strategically gather and utilize resources to expand your train empire- Carriage Merging: Merge different railway carriages to improve functionality and aesthetics- Expansive Railways: Design and lay out tracks across varied landscapes, creating a vast network- Continuous Progression: Your empire grows continuously, offering a satisfying idle gaming experience- Varied Challenges: Encounter different challenges and missions as you expand your reach- Engaging Graphics: Enjoy a visually rich game with detailed trains and environments- Accessible to All: Designed for both casual play and deeper strategic gamingSo, hop aboard and let your train adventure begin!",4.1,141000,10000000,Everyone,Casual games,"Simulation, Idle, Casual, Single player, Stylized, Low poly"
