game_id,game_name,description,score,ratings_count,downloads,content_rating,section,categories
1,Geometry Dash SubZero,"Geometry Dash is back with a brand new adventure!Jump in, brace yourself, and get ready for a real challenge! This won't be easy...Game Features• Rhythm-based Action Platforming!• Three unique levels with amazing music from MDK, Bossfight and Boom Kitty!• Unlock unique SubZero icons to customize your character!• Use practice mode to sharpen your skills!• Challenge yourself with the near impossible!Approved by RubRub \ (•◡•) /",4.5,926000,100000000,Everyone,Abstract graphics,"Action, Platformer, Runner, Arcade, Single player, Abstract, Offline"
2,Word Collect - Word Games Fun,"Download the best word games Free in Word Collect!Word Collect has exciting word games Free Word Nerds! Word Collect starts as an easy word game and gets harder as you level up!=== Enjoy Word Gameplay! ===- Connect letters in any direction to form the hidden word matches!- Find as many words as possible to level up and earn bonus rewards!- Fill in every word block jumbles! Earn bonus coins when you discover hidden words!- Can't figure out the word jumble? Use coins to get a hint and win the level!=== Features ===- Daily bonus coins for free hints!- Daily Challenge gives you more free word games, more free bonus coins and more Fun Every Day!- Over 900+ Levels to play word games free!- Free 500 coins at the first word game login.- Easy to play and difficulty increases as you go!- Play Offline or Online - anytime, anywhere.- Word Collect is the best free word game!- For word games free single player mode, download Word Collect Word Game Now!Get Word Collect for the best word games free for word game fans, word search addicts, and more!Play word games now in Word Collect - it's so addictive!The prizes in this word game are not exchangeable for real-world money or prizes. Having an issue with these free word games for android? For immediate support, contact us at support@superfree.com. Thanks!",4.7,588000,10000000,Everyone,Abstract graphics,"#10 top grossing word, Word, Search, Single player, Abstract, Offline"
3,Tap Away,"Do you have what it takes to solve all the swiping levels? Connect all your braincells and put your skills to the test! Tap Away all the blocks in this exciting puzzle.Tap Away is brought to you by Popcore, makers of hit puzzle games with more than 250 million combined installs!Tap Away is a fun and addictive 3D puzzle game, but it’s more than just that - it’s a brain teaser that will take you to the next level!Tap the blocks to make them fly away and clear the screen. But the blocks will only fly in one direction, so you’ve got to approach this brain teaser carefully! Slide your finger around the screen to rotate the shape and attack the blocks from every angle! As you progress, the blocks form bigger and bigger shapes, and the blocks themselves change form, so you’ll need to get your thinking hat on to solve the puzzles in this 3D puzzle game. And that’s not it! There are skins and themes you can unlock as you get further, as well as challenges to keep you on your toes. In this fun and colorful game, you challenge your logic, critical thinking, and precision. Do you have what it takes?WITH TAP AWAY YOU CAN▶ PLAY the full 3D puzzle game experience offline and on the go.▶ SWIPE to rotate the shape and choose your next move.▶ TAP the blocks to clear the level.▶ CUSTOMIZE your blocks with different skins and themes.▶ REACH the top!WHY PLAY TAP AWAY?▶ RELIEVE your stress.▶ TEASE your brain with the satisfying taps.▶ PRACTICE your critical thinking!▶ LEARN the tricks to ensure Tap Away glory!▶ ENJOY cool skins and themes to customize your journey!What are you waiting for? Challenge your brain with this tricky game right now!TALK TO USJoin your TAP AWAY crew on▶ Web: https://popcore.com/▶ Instagram: https://www.instagram.com/popcore▶ TikTok: https://www.tiktok.com/@popcore▶ Twitter: https://twitter.com/PopcoreOfficial▶ Youtube: https://www.youtube.com/channel/UCq1BDUD72Rv7dXov7WtR9OgDOWNLOAD AND PLAY NOW - Join this fun and satisfying puzzle game and tap away the blocks!",4.3,1130000,50000000,Everyone,Abstract graphics,"Puzzle, Logic, Casual, Single player, Abstract, Miscellaneous, Offline"
4,Sudoku - Classic Sudoku Puzzle,"Enjoy the Classic Sudoku Puzzle Game for free! Immerse yourself in this ad-free, classic number puzzle game, available offline, for a logic-enhancing, fun challenge. DOWNLOAD this free app and start your Sudoku free adventure now, a true testament to mind games and puzzle games alike!Sudoku Puzzle Game stands out as a mind-boosting and intellectual brain sudoku number game on Google Play, with playing . You can download the Sudoku app for your Android phone and tablet to enjoy a Sudoku no ads experience! It's the perfect puzzle game for training your brain, logical thinking, memory, and an excellent way to kill time, making it a pinnacle of .✨Classic Sudoku is a number sudoku free puzzle game, and the goal is to place 1 to 9 digit numbers into each grid cell so that each number can only appear once in each row, each column, and each mini-grid. With our classic Sudoku number puzzle app, you can not only enjoy sudoku puzzle games anytime, anywhere, but also learn Sudoku techniques from it. Embrace the challenge of Sudoku free and modes for a diverse gaming experience, further enriching the puzzle games genre.🌟Key Features🌟From easy to expert, designed to train your brain, making our app a pillar among sudoku puzzle games.Enhance your logical thinking, a must for mind game enthusiasts.🏆New puzzles daily, adding excitement to your journey.Focus solely on solving puzzles without interruptions.Tailor your experience and navigate puzzles smoothly.Our Brain Sudoku app offers a comprehensive brain exercise, improving logical thinking and memory, with to disrupt your gameplay. Features like sound effects, highlight options, and an intuitive interface ensure a seamless experience, online or .💡You may also find the following Brain Sudoku features useful💡100 new puzzles each week, keeping your gameplay fresh.Play without an internet connection.You can share with your friends via Google+, Facebook, Twitter etc..Protect your eyes during late-night sessions.Add a competitive edge to your gameplay.Our has an intuitive interface, easy control, clear layout, and well-balanced difficulty levels for beginners and advanced players, with no ads. As a , it's not only a good time killer but also helps you think, makes you more logical, and improves your memory. Engage your mind with our and experience, the ultimate mind games and puzzle games challenge.When you first open our Sudoku app, you see a guide tour teaching you how to play Sudoku, and when you open the sudoku puzzle game app for the 100th time, you can see yourself as a Sudoku master and a good Sudoku solver. You'd be able to play any web sudoku offline and fast. Come to our Kingdom of Sudoku and keep your mind logical. This is the classic sudoku app for sudoku lovers. If you like to play puzzle games, you should download the game app. You get 10000+ challenging every day to train your brain, and we add 100 sudoku puzzles every week. Each Sudoku offline puzzle has only one true solution. We offer 4 difficulty levels. We add 100 sudoku puzzles every week. now and play sudoku no ads puzzle games every day.For inquiries, email us at 📩support@dailyinnovation.biz. We're always here for you.",4.7,2650000,50000000,Everyone,Abstract graphics,"Puzzle, Logic, Sudoku, Casual, Single player, Abstract, Miscellaneous, Puzzles, Offline"
5,Woodber - Classic Number Game,"Woodber - perfect combination of classic number match with wood block puzzle game!This old-school brain tester from our childhood has returned with a new witty look. Dive into the world of cross math & number game every day to sharpen your mind and increase your IQ. Have a woody good time by playing this zen relaxing woody puzzle filled with wood nuts & a satisfying crunch!🧩 🧩✓ The goal is to clear all the numbers from the board✓ Clear all digits from the wood grid by deleting pairs of equal digits (1 and 1, 6 and 6) or matching pairs of digits that make ten (6 and 4, 3 and 7), all within the framework of cross math and wood nuts✓ Pairs can be connected in adjacent horizontal, vertical, and diagonal cells, as well as at the end of one line and the beginning of the next✓ In case you run out of moves, drop the number lines at the bottom to conquer the cross math & number match✓ Speed up with Hints if you are stuck in this number puzzle, let's become a true number master & wood nuts!✓ Level up once all the numbers are removed from the number puzzle grid🧩 🧩For extra fun, we have prepared something special for you. Play Woodber journey with 100s of new woody block puzzle games every week for free! Each Woodber woody puzzle has a different goal; collect gems and amazing awards!Enjoy daily achievements and unlock cool badges which will definitely cheer you up!🧩 🧩- Statistics - Track your daily Woodber progress, best time, and other achievements- Unlimited Hints - Stuck? No worries, easily go on with one tap! Let's drop the number lines!- Auto-save - If you get distracted and quit your Woodber game unfinished, we’ll save it for you so you can resume anytime- Beautiful graphics and satisfying crunch sound effects- Complete Daily challenges or seasonal events to get unique trophies- Relaxing wood block gameplay with no pressure or time limit- Update hundreds of new puzzles every week- NO WIFI? NO PROBLEM – Enjoy block puzzle games anytime, anywhere!is a true legend among number games like 2048, 2248 and classic sudoku puzzles. This easy mind game is also known as Numberama, Number Match, Take Ten, Match Ten, Merge Number or 10 Seeds. You can play it either online or offline by using a sheet of paper, but nowadays, we prefer mobile versions of tile puzzle games, which you can play on the go :) Solving a number puzzle a day will help you with logic, memory, and math skills training!There are a lot of ways to solve the logic number puzzle, but it’s not as easy as it seems or as playing 2048, 2248. People say this super addictive and relaxing puzzle game helps their mental health as well as lets them relax especially after a hard day. Tease your brain and enjoy an engaging number games experience! If you like merging numbers mechanics, you will enjoy this logic number game!If you have any questions or concerns, please do not hesitate to contact us: support@lihuhugames.com",4.6,225000,10000000,Everyone,Abstract graphics,"Puzzle, Logic, Casual, Single player, Abstract, Offline"
6,"NYT Games: Word, Number, Logic","Keep your mind sharp with word and logic puzzles from New York Times Games. Free to download, the app offers new puzzles daily for every skill level.App Features and Games:NEW: STRANDSOur latest game lets you find hidden words and uncover the day’s theme. It’s the word search you know, with a twist.WORDLEPlay the original Wordle — created by Josh Wardle — in our app. Guess the 5-letter word in 6 tries or less, and analyze your guesses with WordleBot.SPELLING BEEIs scrambling your strong suit? Play the daily Spelling Bee and see how many words you can make with 7 letters.THE CROSSWORDSubscribers can play the same daily puzzle that’s printed in The New York Times, in our app. Crosswords increase in difficulty throughout the week, so there’s something for everyone.CONNECTIONSGroup words with a common thread. See if you can do it with four mistakes or fewer.SUDOKULooking for a numbers game, minus the math? Play Sudoku and fill each 3x3 set of boxes with numbers 1–9. Play a new puzzle every day in easy, medium or hard mode.THE MINI CROSSWORDThe Mini is all the fun of The Crossword, but you can solve it in seconds. These word games don’t increase in difficulty throughout the week and feature simpler clues.TILESUnwind while you match elements in the day’s pattern — the key is to make consecutive matches.LETTER BOXEDCreate words using letters around the square. Letter Boxed is another fun way to test your word-making skills.STATSTrack your progress for The Crossword, Wordle and Spelling Bee. For The Crossword, monitor your average solve times, see how many puzzles you can solve in a row, and more. Plus follow your streak on Wordle, and track how often you reach each level in Spelling Bee.LEADERBOARDSStart a friendly competition with The Mini leaderboards. Add up to 25 friends to see who can solve today’s Mini puzzle the fastest.PUZZLE ARCHIVESubscribers can now solve over 10,000 past puzzles from Wordle, Connections, Spelling Bee and The Crossword.DIGITAL SUBSCRIPTION OPTIONS:You can purchase a monthly or annual New York Times Games subscription.Enjoy unlimited gameplay, The Crossword archive and more with a monthly or annual subscription. See our subscription offers for further details.BY DOWNLOADING THE NEW YORK TIMES GAMES APP, you agree to:• The automatic renewal terms stated above.• The New York Times Privacy Policy: https://www.nytimes.com/privacy/privacy-policy• The New York Times Cookie Policy: https://www.nytimes.com/privacy/cookie-policy• The New York Times California Privacy Notices: https://www.nytimes.com/privacy/california-notice• The New York Times Terms of Service: https://www.nytimes.com/content/help/rights/terms/terms-of-service.htmlPlease note: A subscription to New York Times Games does not include access to any other New York Times products, including but not limited to nytimes.com, New York Times Cooking, Wirecutter, mobile news content and other apps on non-iOS devices.",4.7,76200,5000000,Everyone,Abstract graphics,"#3 top grossing word, Word, Crossword, Single player, Abstract, Miscellaneous, Puzzles, Modern, Offline"
7,Qblock: Wood Block Puzzle Game,"Wood Block Puzzle (also known as Qblock) is a classic wood block puzzle game that offers an addictive block puzzle game experience. This wood block puzzle game challenges you to fit differently shaped blocks into a 8x8 grid with unlimited, no-time-limit gameplay. Play daily to enjoy the new combo mode in this iconic block puzzle game. If you love relaxing yet fun block puzzle games, Wood Block Puzzle is perfect for you!Tetris-inspired, Qblock is a woody-styled block puzzle game designed to and pass the time. This wood block puzzle game features unlimited play, letting you strategically place blocks hassle-free. 🧩 With like T, L, J, and squares, this wood block puzzle game is endlessly entertaining. Dive into the world of wood block and wooden-style block puzzle games now!Our well-designed is optimized for mobile phones📱 and tablets💻. This user-friendly, clean interface block puzzle gameplay caters to all ages. People use block games to keep their minds sharp and build logical thinking abilities. Our rarely-seen wood block puzzle UI offers a clean look and easy gameplay. Enjoy the block journey.⬆️ Rotate pieces in this woody-style block puzzle to increase your score. A unique holder section allows you to set aside pieces for later use, making for more interesting gameplay than other block puzzles. This fun yet brain-training cube block game is a delight. Explore the world of blocks and shapes with our addictive block games!🕹️- Drag and drop blocks into the- Fill rows or columns to eliminate pieces- The block puzzle games end when no space remains for new blocks- Blocks cannot be rotated- Earn scores for each placement and eliminate row/column- Aim for high scores to become the ultimate Wood Block Puzzle champion!🎯- for pure puzzle fun- for a relaxed environment in this block games- Innovative block holder grid for strategic play- Combo mode triggers board shaking at 4+ combos- Crisp and wood carving sound effects- Easy to learn with simple controls- Elaborate wooden interface for a natural vibe and shapes- Constantly updated with new, classic block shapes- Simple yet addictive gameplay!- Weekly block game adventureQblock: Wood Block Puzzle Game is a classic and challenging block puzzle game that tests your strategic thinking and placement skills. Every move matters as you aim to maximize your high score. Share this engaging wood block puzzle game with friends and enjoy some fun and relaxing moments together. Dive into the world of wood block puzzles with Qblock, a must-try block puzzle game!",4.5,1040000,100000000,Everyone,Abstract graphics,"#4 top free puzzle, Puzzle, Block, Casual, Single player, Abstract, Miscellaneous, Puzzles, Miscellaneous, Wood, Offline"
8,World of Kungfu: Dragon&Eagle,"* The full version of this game requires payment to unlock.Begin your journey in World of Kungfu: Dragon & Eagle on mobile! Start your adventure with the trial version featuring Xiangyang City and its surroundings. Unlock the full experience with a one-time purchase, available either after your trial or immediately upon download.Experience the complete PC version on mobile! Journey from Bashu to Jiangdong and the Central Plains. Discover branching storylines and master diverse martial arts styles!Immerse yourself in a stunning pixel-art martial arts RPG featuring strategic turn-based combat. Set in the intrigue-filled Southern Song Dynasty of China, rise from an amateur to a master. Train under ancient schools, uncover martial techniques, and carve your legend in a world where every choice shapes your destiny.[Vast Open World Exploration]Venture through a martial arts realm spanning the lands of Xiangyang, Jingzhou, Jiangdong, Central Plains, and beyond. Uncover hidden paths through misty mountains, cross treacherous rivers, and explore ancient towns. Discover legendary martial arts schools from the Qingcheng Clan, Shaolin Temple to the Mt. Jun Beggar Gang. Your journey, your rules.[Epic Branching Narrative]Immerse yourself in an extensive story spanning two main storylines featuring the Deserted Temple and the Feather Robes respectively. Experience multiple narrative paths through martial schools and noble houses, leading to over a dozen endings. Each journey offers 40+ hours of choice-driven gameplay.[Legendary Companions]Forge alliances with a diverse cast of characters. Will you stand with noble fighters and talented scholars, or align with imperial agents and mysterious outlaws? Shape the balance of power by your choices.[Extensive Martial Arts System]Master fighting styles including swordplay, staff techniques, hand-to-hand combat, hidden weapons, melody techniques, and more. Discover 300+ special abilities and 350+ traits. Create your unique fighting style![Treasure Hunt Beyond Combat]There's more to this game than fighting! You can also mine ores to enhance equipment, identify artifacts to get powerful weapons, and even recruit certain NPCs—from bandits to wildlife—as companions.Download World of Kungfu: Dragon & Eagle now and write your own martial arts legend!Follow Us:http://www.chillyroom.comEmail: info@chillyroom.gamesInstagram: @chillyroomincTwitter: @ChillyRoomDiscord: https://discord.gg/3dwT35F9JH",4.7,2380,100000,Teen,Be the first to play,Role Playing
9,Pocket Hockey Stars,"Rule the arena with Pocket Hockey Stars, a fast-paced, action-packed 3v3 ice hockey brawl game! Compete in thrilling PvP matches and level up your team of hockey heroes to master the art of competitive arcade-style hockey battles.Key Features:Fast-Paced PvP Action: Engage in quick competitive matches that test your skills and strategy on the ice.Unlock Hockey Legends: Discover and collect unique heroes, each with their own powerful traits and special abilities.Build your ultimate ice hockey dream team to win!Explore New Worlds: Progress through arenas and unlock hidden traits, rewards, and exciting new content.Upgrade Your Heroes: Level up your team and customize your playstyle to dominate your opponents.Arcade-Style Gameplay: A thrilling mix of fast-paced action and strategic depth that keeps you coming back for more.Challenge your friends: invite your pals to friendly PvP games and show who is the true Pocket Hockey Champion! 🏆Pocket Hockey Stars is perfect for fans of arcade sports and PvP games. Whether you're a hockey enthusiast or just love intense, competitive action, this game delivers!Start your journey to hockey greatness today!",2.5,160,10000,Everyone,Be the first to play,Sports
10,Cooking Blitz: Restaurant Game,"Play the excellent cooking games to prepare & serve world cuisine! As a master chef and catering tycoon, decorate your restaurants and cater to picky diners to build your cuisine empire in this simulation cooking game!Improve your cooking skills and master massive recipes across various culinary cultures in cooking games! From fast food and gourmet dishes to traditional local snacks, immerse yourself in cooking fun created by our cooking game's realistic graphics, animations, and sound effects.Scan orders, tap to prep ingredients, cook in order, and serve dishes swiftly to master the cooking game's adventures.🧠 Strategize with Time Management: As orders pile up, plan your moves and prioritize tasks to satisfy customers and maximize tips.🍴 Improve Kitchenware: Better tools mean more efficient cooking games and result in happier customers and bigger rewards.🎊 Boost Cooking Fun: Use powerful boosts to meet your cooking game goals even in the most overbooked of services.Enjoy cooking games as a cooking master! Hone your time management and cooking skills within the game. In this cooking game, you'll juggle diverse customer demands and earn bonuses, building goodwill as a successful chef. This cooking game perfects the balance of precision and timing, sharpening your expertise in various cooking skills to excellence!Terms of Service: https://cooking-blitz.gurugame.ai/termsofservice.htmlPrivacy Policy: https://cooking-blitz.gurugame.ai/policy.html",4.4,147,10000,Everyone,Be the first to play,Simulation
11,Number Match - Number Game,"The most addictive blend of free number match puzzles and rewarding brain training awaits you!🔢 This number match game is designed to boost your brainpower with easy-to-learn yet deeply challenging number match puzzles. With large, clear digits for effortless play, this math game is perfect for players of all ages!Stay sharp as you enjoy the thrill of special math events. Chase high scores and unlock postcards from exciting destinations along your number journey! 💪📈 Clear the board by removing all numbers.💯 Match pairs of numbers that are the same or add up to 10.🔢 Tap the numbers one by one to remove them and earn points.✔️ Pairs can be connected horizontally, vertically, diagonally, or across the end of one line to the start of the next.🔗 If you run out of moves, try to add the remaining numbers to extra lines at the bottom.🌟 Use Hints if you're stuck to keep the math game going.🏆 Clear the entire board to win the logic game and achieve the highest score!- Easy-to-start Brain Training:This classic number game is perfect for keeping your mind sharp with fun number match puzzles.- Score Tracking:Challenge yourself to beat your best scores in this addictive blend of number games and math puzzles.- Large, Clear Digits:Play comfortably with big, easy-to-read digits designed for effortless tapping.- Postcard Collection:Complete levels and unlock postcards while exploring exciting destinations in this unique number match adventure.- Relaxing Experience:No time limits. Enjoy stress-free play as you connect numbers at your own pace.- Helpful Tools:Use hints and boosters to overcome tricky challenges and keep your number game streak alive.- Endless Levels:Stay entertained with countless math puzzles and new challenges that make this classic number game endlessly fun.This is a game that fits every number lover! Whether you're looking to relax 🧘, sharpen your mind 🧗, or enjoy a quick challenge 🚴, this number match game is your perfect companion. Featuring easy-to-learn number match gameplay, large digits for stress-free tapping, and no time limits, this classic number game fits seamlessly into your day. Enjoy unlocking postcards, boosting your brainpower, and diving into the fun of number games designed for all skill levels.Have endless fun with numbers anytime, anywhere. Step into the world of number puzzles with endless levels that never lose their charm. Chase high scores in thrilling math games, connect digits in unique ways, and use tools to tackle tricky challenges.Whether you're unlocking rewards, playing for relaxation, or pushing your limits, our number match game combines everything you love about number match puzzles and more. Download and enjoy the ultimate number game experience! 🤩Terms of Service: https://number.nimblemind.studio/termsofservice.htmlPrivacy Policy: https://number.nimblemind.studio/policy.html",5.0,871,50000,Everyone,Be the first to play,Puzzle
